id,title,score,url,num_comments,created_utc
1jwz2d3,Bitcoin Newcomers FAQ - Please read!,109,https://www.reddit.com/r/Bitcoin/comments/1jwz2d3/bitcoin_newcomers_faq_please_read/,23,1744401555.0
1mc3tx5,"Daily Discussion, July 29, 2025",21,https://www.reddit.com/r/Bitcoin/comments/1mc3tx5/daily_discussion_july_29_2025/,14,1753769389.0
1mc5k3t,Old but Gold,543,https://i.redd.it/ny787gqmsrff1.png,19,1753776080.0
1mc9c0q,"Trust us, we're broke.",198,https://i.redd.it/s8c05ruuxsff1.jpeg,4,1753789929.0
1mc8gnk,"I woke up and came to a realization this morning. I thought to myself, if I really think Bitcoin is going to a million in the next decade, which I do, why not go all in?",196,https://www.reddit.com/r/Bitcoin/comments/1mc8gnk/i_woke_up_and_came_to_a_realization_this_morning/,114,1753787102.0
1mc88sb,Bitcoin Hodler mansion in 2035,187,https://i.redd.it/zl5vly68nsff1.png,10,1753786368.0
1mc5tbh,"In just 16 years, Bitcoin has surpassed the silver market in terms of market capitalization",161,https://i.redd.it/cfa28yqqvrff1.jpeg,12,1753777103.0
1mbwww8,Finally finished The Bitcoin Standard,565,https://i.redd.it/zrazcxpkhpff1.jpeg,41,1753748125.0
1mbk65c,"""Bitcoin is like gold. It's digital gold,"" says Fed Chair Powell.🔥",1637,https://v.redd.it/75aq957i1nff1,97,1753718518.0
1mbgmqm,HUGE BREAKING: Payments giant PayPal has 'enabled' Bitcoin and 'crypto' payments for all US merchants 🇺🇸,2417,https://i.redd.it/n1spefi3dmff1.png,126,1753710433.0
1mc4bnx,"""We are still early"" is not a meme, its the truth",53,https://www.reddit.com/r/Bitcoin/comments/1mc4bnx/we_are_still_early_is_not_a_meme_its_the_truth/,8,1753771278.0
1mbo7e2,"Daily Bitcoin meme until BTC is at $200,000 #54",509,https://i.redd.it/e39opnmprnff1.jpeg,28,1753727346.0
1mbo5sy,Bitcoin is a better store of value than real estate.,458,https://v.redd.it/ena4bjmhrnff1,40,1753727245.0
1mc9wcx,Bali knows what’s up…,15,https://i.redd.it/p3dd3lms2tff1.jpeg,1,1753791584.0
1mc6q9o,US seeks to claim $2.4M in Bitcoin seized from ransomware group,27,https://cointelegraph.com/news/us-bitcoin-reserve-seizure-foia-dispute,0,1753780721.0
1mbtcoe,The minimum HODL period for Bitcoin should be a decade,187,https://www.reddit.com/r/Bitcoin/comments/1mbtcoe/the_minimum_hodl_period_for_bitcoin_should_be_a/,72,1753739023.0
1mbxcri,Uber of SE Asia now accepts Bitcoin,103,https://www.banklesstimes.com/articles/2025/07/28/grab-southeasr-asias-largest-ride-app-now-supports-crypto-top-ups/,2,1753749343.0
1mc3d1p,Bitcoin Network Update 📢,38,https://i.redd.it/ckquhs9n3rff1.png,2,1753767681.0
1mbipzx,Update on doing that risky HELOC thing.  It went as expected...,487,https://i.redd.it/raxdwaraqmff1.png,139,1753715265.0
1mbg71l,I found my seed phase,649,https://www.reddit.com/r/Bitcoin/comments/1mbg71l/i_found_my_seed_phase/,218,1753709343.0
1mbe50r,Lambo money doesn’t start when you can afford one. It starts when you could afford to buy one and not know the difference.,793,https://www.reddit.com/r/Bitcoin/comments/1mbe50r/lambo_money_doesnt_start_when_you_can_afford_one/,121,1753703686.0
1mc1ht0,I Never Knew How Much Charlie Munger Truly Despised CRYPTO,37,https://youtube.com/shorts/ODAsckXQ4oo?si=ovxmFZwY17dAZZQ3,30,1753761448.0
1mbf83l,Did Satoshi post about Bitcoin in 2002?,575,https://i.redd.it/mttbkqvr2mff1.jpeg,35,1753706832.0
1mc996r,RAKBANK First UAE Bank Offering Retail Bitcoin Trading,7,https://www.cryptocoverage.co/news/rakbank-first-uae-bank-offering-retail-bitcoin-trading,0,1753789680.0
1mbrfmu,Coinbase Credit Card Tiers,109,https://i.redd.it/ncev71xadoff1.jpeg,84,1753734580.0
1mbguy7,My financial advisor looking at my portfolio that 100% Bitcoin,338,https://i.redd.it/r38gjrswemff1.png,13,1753710978.0
1mc2q8u,"Where to buy bitcoin, in the Philippines",20,https://www.reddit.com/r/Bitcoin/comments/1mc2q8u/where_to_buy_bitcoin_in_the_philippines/,13,1753765488.0
1mc1ia0,"If there was a checklist, nothing in history checks all the boxes, until Bitcoin.",21,https://www.reddit.com/r/Bitcoin/comments/1mc1ia0/if_there_was_a_checklist_nothing_in_history/,13,1753761491.0
1mbzd4n,Gold goes grrrr,26,https://www.ndtv.com/offbeat/us-startup-claims-to-have-found-new-way-to-make-5-000-kg-of-gold-every-year-8967892,5,1753755028.0
1mbiul1,BITCOIN LOGO SECRET,192,https://i.redd.it/fsykuslksmff1.png,69,1753715560.0
1mbioj6,"Billionaire asset manager Ray Dalio has argued that investors should allocate at least 15% of their portfolios to Bitcoin and Gold, as a hedge against macroeconomic risks.",190,https://decrypt.co/332083/billionaire-ray-dalio-urges-investors-to-allocate-15-of-portfolios-to-gold-and-bitcoin,14,1753715172.0
1mc6vfx,DCA bitcoin,5,https://www.reddit.com/r/Bitcoin/comments/1mc6vfx/dca_bitcoin/,8,1753781266.0
1mca59f,🚨 Breaking : Goldman Sachs and BNY Mellon Tokenize Money-Market Funds,3,https://www.reddit.com/r/Bitcoin/comments/1mca59f/breaking_goldman_sachs_and_bny_mellon_tokenize/,1,1753792276.0
1mc6to5,BTC/EUR quietly making new highs — a reminder why Bitcoin protects your capital,5,https://www.reddit.com/r/Bitcoin/comments/1mc6to5/btceur_quietly_making_new_highs_a_reminder_why/,14,1753781082.0
1mbch4c,Who needs to hear this today?!,331,https://i.redd.it/u9ji83pxclff1.png,25,1753698155.0
1mc297a,🚀 I automated my Bitcoin DCA strategy in a weekend using n8n and AI – my first workflow project,11,https://www.reddit.com/r/Bitcoin/comments/1mc297a/i_automated_my_bitcoin_dca_strategy_in_a_weekend/,1,1753763881.0
1mbl5p9,Stop whining,91,https://www.reddit.com/r/Bitcoin/comments/1mbl5p9/stop_whining/,29,1753720698.0
1mbhqak,Thus Immortan Satoshi speaks!,122,https://i.redd.it/ay2s66d7lmff1.jpeg,9,1753713025.0
1mca8vb,"If you’re into Bitcoin ETFs and don’t have a Roth IRA, you’re missing out on Tax Free Gains!",2,https://www.reddit.com/r/Bitcoin/comments/1mca8vb/if_youre_into_bitcoin_etfs_and_dont_have_a_roth/,0,1753792550.0
1mbo1km,The Kilowatt Dollar: Bitcoin’s Forgotten Ancestor from 1981,53,https://i.redd.it/ddj6q3fppnff1.jpeg,2,1753726985.0
1mba6ea,Having bitcoin in Italy…,350,https://www.reddit.com/r/Bitcoin/comments/1mba6ea/having_bitcoin_in_italy/,182,1753689295.0
1mbpnu8,FIAT mindset: The fear of deflation,30,https://www.reddit.com/r/Bitcoin/comments/1mbpnu8/fiat_mindset_the_fear_of_deflation/,34,1753730564.0
1mb3ibe,Does anyone wish to go back in time? When BTC was $0.01 in 2010,720,https://i.redd.it/821mdrq4riff1.png,189,1753666598.0
1mbq4kb,Your Daily Bitcoin Breakdown newsletter is now live. Check out today’s Top Stories and a sneak peek at the latest Quick Bits snippets. Full issue link is in the comments.,25,https://www.reddit.com/gallery/1mbq4kb,1,1753731618.0
1mca9hy,Risky,1,https://i.redd.it/rr94nq2t5tff1.jpeg,0,1753792596.0
1mca633,Android wallet opinions,1,https://www.reddit.com/r/Bitcoin/comments/1mca633/android_wallet_opinions/,1,1753792341.0
1mbk3mp,Small Miner Hits The BTC Lottery,42,https://youtu.be/_unz4cXgM7A,4,1753718378.0
1mc9t69,Need help. Phoenix wallet shows withdrawal of my BTC,1,https://www.reddit.com/r/Bitcoin/comments/1mc9t69/need_help_phoenix_wallet_shows_withdrawal_of_my/,0,1753791329.0
1mbsa2z,People Don’t Actually Hate Capitalism. They Hate Fiat.,15,https://youtu.be/qNqNEIKjGEU,2,1753736505.0
1mc3r7m,strike verification issues,4,https://www.reddit.com/r/Bitcoin/comments/1mc3r7m/strike_verification_issues/,1,1753769098.0
1mb32l2,"Bitcoin is not going up, Fiat is going down",548,https://www.reddit.com/r/Bitcoin/comments/1mb32l2/bitcoin_is_not_going_up_fiat_is_going_down/,88,1753665299.0
1mbwxs7,Bhutan is WINNING with #bitcoin. 🇧🇹,8,https://www.youtube.com/watch?v=MYcOqJIVJq4,1,1753748193.0
1mb0j73,How is this not getting more attention?,688,https://www.reddit.com/gallery/1mb0j73,135,1753658044.0
1mbja1z,Bitcoin Is The New King of Wall Street,28,https://www.youtube.com/watch?v=UynQPlUAmKM,0,1753716538.0
1mbltoi,Possible scam,18,https://i.redd.it/xiq9g8c9cnff1.jpeg,8,1753722122.0
1mb6wmt,52 year old first Bitcoin purchase!,175,https://www.reddit.com/r/Bitcoin/comments/1mb6wmt/52_year_old_first_bitcoin_purchase/,26,1753677138.0
1mbhj4t,"Is too late guys, don't buy BTC",26,https://i.redd.it/zwastz0ujmff1.png,15,1753712572.0
1mavys5,"If Bitcoin was $300k today, I would still buy",808,https://www.reddit.com/r/Bitcoin/comments/1mavys5/if_bitcoin_was_300k_today_i_would_still_buy/,159,1753646405.0
1mazto8,Here's why bitcoin is my saving grace as a third-world dweller,465,https://www.reddit.com/r/Bitcoin/comments/1mazto8/heres_why_bitcoin_is_my_saving_grace_as_a/,56,1753656129.0
1mb5f5c,Fire Sub 3 years ago - Bitcoin Won,199,https://www.reddit.com/gallery/1mb5f5c,30,1753672396.0
1mc1jv2,"Getting Paid in Bitcoin, Earning BTC Cashback, and Saving in a BTC HYSA - Should I Still Track Gains/Losses or Just Keep Stacking?",2,https://www.reddit.com/r/Bitcoin/comments/1mc1jv2/getting_paid_in_bitcoin_earning_btc_cashback_and/,3,1753761624.0
1mc57zw,Can you help me choose my new design?,0,https://i.redd.it/tf6ywcpoorff1.jpeg,21,1753774756.0
1mc0n5v,Hardware wallet,2,https://www.reddit.com/r/Bitcoin/comments/1mc0n5v/hardware_wallet/,2,1753758823.0
1mc97jj,"Might get bashed here but welcome folks, to the 21st century slave-master reset. Where you own “nothing” aka bitcoin and be happy (cause the wealth inequality will be even more extreme, entire bloodlines will change).",0,https://www.reddit.com/r/Bitcoin/comments/1mc97jj/might_get_bashed_here_but_welcome_folks_to_the/,7,1753789541.0
1mbb1df,"No Internet, No Problem – Send Bitcoin Anyway!",40,https://www.reddit.com/r/Bitcoin/comments/1mbb1df/no_internet_no_problem_send_bitcoin_anyway/,14,1753692745.0
1mbktb8,Sparrow Wallet Advanced Features Tutorial,10,https://youtu.be/ppZ9cPvGTVU?si=AE7cYbXTUYbC4er8&utm_source=ZTQxO,0,1753719931.0
1mc1pu8,Operating system choice,2,https://www.reddit.com/r/Bitcoin/comments/1mc1pu8/operating_system_choice/,4,1753762132.0
1mbleaw,Two years ago - the 10K wallet guy's post... those all moved this month,9,https://www.reddit.com/r/Bitcoin/comments/1mbleaw/two_years_ago_the_10k_wallet_guys_post_those_all/,0,1753721218.0
1mb1yny,Where do you all buy Bitcoin?,163,https://www.reddit.com/r/Bitcoin/comments/1mb1yny/where_do_you_all_buy_bitcoin/,242,1753662062.0
1mawp8w,"The difference is clear, Bitcoin is the future of finance",319,https://v.redd.it/3i8cci2e8hff1,45,1753648181.0
1mbqtig,ISSN officially approved for Bitcoin Review of Books :),4,https://www.reddit.com/r/Bitcoin/comments/1mbqtig/issn_officially_approved_for_bitcoin_review_of/,0,1753733200.0
1mbhzws,Thought about stoping my DCA because price was too high…,10,https://www.reddit.com/r/Bitcoin/comments/1mbhzws/thought_about_stoping_my_dca_because_price_was/,2,1753713633.0
1mbguiw,Why Do We Always Underestimate Greed in Bull Markets🤑丨The Why Series,11,https://v.redd.it/dm5pdkm0fmff1,0,1753710949.0
1mc91t9,Is satoshi a time traveler?,0,https://www.reddit.com/r/Bitcoin/comments/1mc91t9/is_satoshi_a_time_traveler/,23,1753789038.0
1mc02mn,BTC staking VS borrowing against bitcoin,0,https://www.reddit.com/r/Bitcoin/comments/1mc02mn/btc_staking_vs_borrowing_against_bitcoin/,41,1753757095.0
1mb8jcu,"Daily Discussion, July 28, 2025",44,https://www.reddit.com/r/Bitcoin/comments/1mb8jcu/daily_discussion_july_28_2025/,76,1753683009.0
1maxddm,Tier List,226,https://i.redd.it/ixzq3osbdhff1.jpeg,64,1753649840.0
1mbpyiw,Casascius BTC - 1BTC coins,4,https://www.reddit.com/r/Bitcoin/comments/1mbpyiw/casascius_btc_1btc_coins/,11,1753731232.0
1makbjm,That's impressive,848,https://i.redd.it/107jvm5fneff1.png,86,1753616921.0
1mc6a27,Should I wait until November to buy a lump-sum? Is this prediction still relevant?,0,https://www.reddit.com/r/Bitcoin/comments/1mc6a27/should_i_wait_until_november_to_buy_a_lumpsum_is/,61,1753778981.0
1mbnchd,"RGB v0.11.1 Launches, Allowing The Creation Of Digital Assets on Bitcoin Mainnet",3,https://www.nasdaq.com/articles/rgb-v0111-launches-allowing-creation-digital-assets-bitcoin-mainnet,0,1753725475.0
1mb4nzq,Thinking about selling my $IBIT for real bitcoin,51,https://www.reddit.com/r/Bitcoin/comments/1mb4nzq/thinking_about_selling_my_ibit_for_real_bitcoin/,45,1753670088.0
1mc6y3i,Life after getting wealthy sucks!,0,https://www.reddit.com/r/Bitcoin/comments/1mc6y3i/life_after_getting_wealthy_sucks/,27,1753781551.0
1mbibwf,Building a seedSigner using a Raspberry Pi Zero from AliExpress—safe or not?,6,https://www.reddit.com/r/Bitcoin/comments/1mbibwf/building_a_seedsigner_using_a_raspberry_pi_zero/,4,1753714391.0
1mbfhp2,Move to cold storage?,5,https://www.reddit.com/r/Bitcoin/comments/1mbfhp2/move_to_cold_storage/,17,1753707566.0
1mbvp5s,Serious question,1,https://www.reddit.com/r/Bitcoin/comments/1mbvp5s/serious_question/,33,1753744898.0
1mbpj45,Super new,1,https://www.reddit.com/r/Bitcoin/comments/1mbpj45/super_new/,19,1753730275.0
1mbv1fi,When to transfer to cold wallet.,0,https://www.reddit.com/r/Bitcoin/comments/1mbv1fi/when_to_transfer_to_cold_wallet/,13,1753743196.0
1mbv0md,Skillmasters.io now accepting bitcoin as a form of payment,0,https://www.reddit.com/r/Bitcoin/comments/1mbv0md/skillmastersio_now_accepting_bitcoin_as_a_form_of/,0,1753743136.0
1maukzh,God Candle painting,160,https://v.redd.it/ibpdwwrysgff1,61,1753643031.0
1mbuel2,Stack SATS,0,https://www.reddit.com/r/Bitcoin/comments/1mbuel2/stack_sats/,0,1753741581.0
1mb9nj2,"Bitcoin: Freedom, Not Easy Money. Chronicle of a Misunderstood Revolution.",15,https://inbitcoinwetrust.substack.com/p/bitcoin-freedom-not-easy-money-chronicle,3,1753687205.0
1mbb5bw,The 80% HODL - 20% trade strategy?,11,https://www.reddit.com/r/Bitcoin/comments/1mbb5bw/the_80_hodl_20_trade_strategy/,20,1753693197.0
1max5oj,What a weekend!,105,https://v.redd.it/spzd87zjbhff1,1,1753649299.0
1mb4b0g,"$1,000 investment",40,https://www.reddit.com/r/Bitcoin/comments/1mb4b0g/1000_investment/,48,1753668970.0
1mbmwhm,Help me invest as a beginner,3,https://www.reddit.com/r/Bitcoin/comments/1mbmwhm/help_me_invest_as_a_beginner/,4,1753724488.0
1manes9,"Heard it before, bought the dip before",316,https://i.redd.it/bhmnzvuldfff1.jpeg,22,1753625815.0
1mb70pw,BTC vs. MSFT,21,https://www.reddit.com/r/Bitcoin/comments/1mb70pw/btc_vs_msft/,42,1753677527.0
1maka27,When you hit a block as a solo miner,438,https://i.redd.it/33ulyry0neff1.jpeg,12,1753616786.0
1mb1zsi,Will future generations view Bitcoin as obvious—or as controversial as we do fiat today?,30,https://www.reddit.com/r/Bitcoin/comments/1mb1zsi/will_future_generations_view_bitcoin_as_obviousor/,46,1753662156.0
